{
  "some_string": "test",
  "some_int": 42,
  "some_float": 42.24,
  "some_dict": {
    "key1": "test_string",
    "key2": 3
  },
  "some_nested_dict": {
    "KEY1": {
      "subKEY1": "test_string",
      "subKEY2": 5
    }
  },
  "nested_array": [
    {
      "KEY1": {
        "subKEY1": "test_string1",
        "subKEY2": 1
      }
    },
    {
      "KEY1": {
        "subKEY1": "test_string2",
        "subKEY2": 2
      }
    },
    {
      "KEY1": {
        "subKEY1": "test_string3",
        "subKEY2": 3
      }
    }
  ]
}